{
  "schema_version": "1.0.0",
  "dataset_version": "0.3.28",
  "approved_at": "2026-08-13",
  "record_id": "super-v8",
  "simulator": "ams2",
  "telemetry_name": "Super V8",
  "telemetry_class": "SuperV8",
  "observed_game_version": "1.6.9.91",
  "observed_through": "SimHub guided verification observation ams2.super-v8.20260813t203713378z-d8774281",
  "approved_controls": {
    "forward_gears": 6,
    "shift_actuation": "sequential-stick",
    "shift_pattern": "sequential",
    "standing_start_clutch": "required",
    "throttle_lift": "not-required",
    "automatic_cut": "yes",
    "automatic_blip": "no",
    "manual_blip": "required",
    "wheel_rim_shape": "round",
    "wheel_integrated_display": "no",
    "wheel_shift_lights": "no",
    "wheel_open_top": "no",
    "running_shift_clutch": "not-required"
  },
  "confidence_notes": "Controls were directly observed with assists disabled; the category's sequential transaxle and retained stick shift are supported by registered sources.",
  "scope_notes": "Single exact identity from one guided-verification drive. The car is Reiza's fictionalised Supercars representation and is not claimed to match a specific entrant."
}
