{
  "schema_version": "1.0.0",
  "dataset_version": "0.3.7",
  "approved_at": "2026-08-11",
  "record_id": "chevrolet-corvette-c5-r",
  "simulator": "ams2",
  "telemetry_name": "Chevrolet Corvette C5-R",
  "telemetry_class": "GT1_05",
  "observed_game_version": "1.6.9.91",
  "observed_through": "SimHub 9.11.22",
  "approved_controls": {
    "forward_gears": 6,
    "shift_actuation": "sequential-stick",
    "standing_start_clutch": "required",
    "running_shift_clutch": "not-required",
    "throttle_lift": "not-required",
    "automatic_cut": "yes",
    "automatic_blip": "no",
    "manual_blip": "unknown",
    "wheel_rim_shape": "round"
  },
  "confidence_notes": "Exact identity, six sequential-stick gears, no paddles, standing-start clutch, automatic cut, no automatic blip, manual rev matching, and round no-display rim were directly observed.",
  "scope_notes": "The exact historical chassis year remains qualified; the approval applies to the exact AMS2 telemetry identity. The exact Low Downforce identity inherits the base controls as an approved aero-only assumption and was not separately tested. Dataset 0.5.66 returned the real car's downshift blip to unknown: the required reading came from one AMS2 drive, and later GTR2 and PMR drives recorded no blip. Each simulator's reading is kept as an override."
}
