{
  "schema_version": "1.0.0",
  "dataset_version": "0.3.8",
  "approved_at": "2026-08-11",
  "record_id": "milano-gt36",
  "simulator": "ams2",
  "telemetry_name": "Milano GT36",
  "telemetry_class": "GT2_05",
  "observed_game_version": "1.6.9.91",
  "observed_through": "SimHub 9.11.22",
  "approved_controls": {
    "forward_gears": 6,
    "shift_actuation": "sequential-stick",
    "standing_start_clutch": "required",
    "running_shift_clutch": "not-required",
    "throttle_lift": "not-required",
    "automatic_cut": "yes",
    "automatic_blip": "no",
    "manual_blip": "required",
    "wheel_rim_shape": "round"
  },
  "confidence_notes": "Exact identity, six sequential-stick gears, no paddles, standing-start clutch, automatic cut, no automatic blip, manual rev matching, and round no-display rim were directly observed.",
  "scope_notes": "No real-world analogue is approved; this record is limited to the exact fictional AMS2 identity."
}
