{
  "schema_version": "1.0.0",
  "dataset_version": "0.3.42",
  "approved_at": "2026-08-14",
  "record_id": "formula-classic-gen3-model1",
  "simulator": "ams2",
  "telemetry_name": "Formula Classic Gen3 Model1 - High Downforce",
  "telemetry_class": "F-Classic_Gen3_HD",
  "observed_game_version": "1.6.9.91",
  "observed_through": "SimHub guided verification observation ams2.formula-classic-gen3-model1-high-downforce.20260815t034551076z-4bd7efa6",
  "approved_controls": {
    "forward_gears": 6,
    "shift_actuation": "h-pattern",
    "shift_pattern": "standard-h",
    "standing_start_clutch": "required",
    "throttle_lift": "required",
    "automatic_cut": "no",
    "automatic_blip": "no",
    "manual_blip": "unknown",
    "wheel_rim_shape": "round",
    "wheel_integrated_display": "no",
    "wheel_shift_lights": "no",
    "wheel_open_top": "no",
    "running_shift_clutch": "not-required"
  },
  "confidence_notes": "Guided testing directly established the gear count, the standing-start clutch, the clutchless running shifts, and the automatic cut and blip state.",
  "scope_notes": "Single exact identity staged from one guided-verification drive.",
  "additional_telemetry_names": [
    {
      "value": "Formula Classic Gen3 Model1",
      "basis": "Base configuration of the same car, observed exactly in live telemetry. AMS2 selects the aero configuration from the circuit, so a driver reaches this identity without choosing it. Controls are inherited from the driven high-downforce configuration and were not separately tested."
    },
    {
      "value": "Formula Classic Gen3 Model1 - Low Downforce",
      "basis": "Low-downforce configuration of the same car, observed exactly in live telemetry. AMS2 selects the aero configuration from the circuit, so a driver reaches this identity without choosing it. Controls are inherited from the driven high-downforce configuration and were not separately tested."
    }
  ]
}
