{
  "schema_version": "1.0.0",
  "dataset_version": "0.4.6",
  "approved_at": "2026-08-21",
  "record_id": "sprint-race",
  "simulator": "ams2",
  "telemetry_name": "Sprint Race",
  "observed_game_version": "1.6.9.91",
  "observed_through": "SimHub guided verification observation ams2.sprint-race.20260822t040810093z-2415554e",
  "approved_controls": {
    "forward_gears": 6,
    "shift_actuation": "sequential-paddles",
    "shift_pattern": "sequential",
    "standing_start_clutch": "required",
    "throttle_lift": "not-required",
    "automatic_cut": "yes",
    "automatic_blip": "yes",
    "manual_blip": "not-required",
    "wheel_rim_shape": "gt-formula",
    "wheel_integrated_display": "no",
    "wheel_shift_lights": "no",
    "wheel_open_top": "no",
    "running_shift_clutch": "not-required"
  },
  "confidence_notes": "Six gears, paddle actuation, a standing-start clutch, clutchless running shifts, automatic cut and automatic blip were directly observed. The cockpit has a closed GT/formula-style rim without an integrated display or shift lights. SimHub's clutch channel cannot distinguish the driver's pedal from a car-side clutch intervention.",
  "scope_notes": "Single exact identity staged from one guided-verification drive.",
  "telemetry_class": "SprintRace"
}
