{
  "schema_version": "1.0.0",
  "dataset_version": "0.3.26",
  "approved_at": "2026-08-13",
  "record_id": "mclaren-570s-gt4",
  "simulator": "ams2",
  "telemetry_name": "McLaren 570S GT4",
  "telemetry_class": "GT4",
  "observed_game_version": "1.6.9.91",
  "observed_through": "SimHub guided verification observation ams2.mclaren-570s-gt4.20260813t170516846z-de4eb92e",
  "approved_controls": {
    "forward_gears": 7,
    "shift_actuation": "sequential-paddles",
    "shift_pattern": "sequential",
    "standing_start_clutch": "not-required",
    "throttle_lift": "not-required",
    "automatic_cut": "yes",
    "automatic_blip": "yes",
    "manual_blip": "not-required",
    "wheel_rim_shape": "d-shaped",
    "wheel_integrated_display": "no",
    "wheel_shift_lights": "no",
    "wheel_open_top": "no",
    "running_shift_clutch": "not-required"
  },
  "confidence_notes": "Controls were directly observed with assists disabled; McLaren's customer-racing material establishes the seven-speed dual clutch SSG.",
  "scope_notes": "Single exact identity from one guided-verification drive. Revised 2026-08-25 without a new drive: throttle lift from unknown to not-required, on the automatic cut this record already establishes. A gearbox that cuts the throttle itself leaves the driver nothing to lift for, and the registered archetype for this mechanism carries the same value. No new observation was taken and no other approved value changed."
}
