{
  "schema_version": "1.0.0",
  "dataset_version": "0.4.17",
  "approved_at": "2026-08-23",
  "record_id": "mercedes-amg-gt3-evo",
  "simulator": "acc",
  "telemetry_name": "Mercedes AMG GT3 Evo 2020",
  "observed_game_version": "21257365",
  "observed_through": "SimHub guided verification observation acc.mercedes-amg-gt3-evo-2020.20260823t011325563z-afff3f23",
  "approved_controls": {
    "forward_gears": 6,
    "shift_actuation": "sequential-paddles",
    "shift_pattern": "sequential",
    "standing_start_clutch": "not-required",
    "automatic_cut": "unknown",
    "automatic_blip": "yes",
    "manual_blip": "not-required",
    "wheel_rim_shape": "gt-formula",
    "wheel_integrated_display": "no",
    "wheel_shift_lights": "no",
    "wheel_open_top": "no",
    "running_shift_clutch": "not-required"
  },
  "confidence_notes": "ACC directly established the year-qualified Evo identity, clutch-required launch, six paddles, no-lift upshift acceptance, automatic blip and closed no-display/no-light rim.",
  "scope_notes": "Single exact identity staged from one guided-verification drive.",
  "telemetry_class": "GT3"
}
