{
  "schema_version": "1.0.0",
  "dataset_version": "0.3.41",
  "approved_at": "2026-08-14",
  "record_id": "lotus-renault-98t",
  "simulator": "ams2",
  "telemetry_name": "Lotus Renault 98T - High Downforce",
  "telemetry_class": "F-Classic_Gen1_HD",
  "observed_game_version": "1.6.9.91",
  "observed_through": "SimHub guided verification observation ams2.lotus-renault-98t-high-downforce.20260814t154354295z-af25e11d",
  "approved_controls": {
    "forward_gears": 6,
    "shift_actuation": "h-pattern",
    "shift_pattern": "standard-h",
    "standing_start_clutch": "required",
    "throttle_lift": "required",
    "automatic_cut": "no",
    "automatic_blip": "no",
    "manual_blip": "required",
    "wheel_rim_shape": "round",
    "wheel_integrated_display": "no",
    "wheel_shift_lights": "no",
    "wheel_open_top": "no",
    "running_shift_clutch": "not-required"
  },
  "confidence_notes": "Guided testing directly established five H-pattern gears in the simulator on a standard gate, the standing-start clutch, the clutchless running shift, and the absence of automatic cut and blip. The real car's sixth gear comes from a registered source and is recorded as a simulator override.",
  "scope_notes": "Single exact identity staged from one guided-verification drive.",
  "additional_telemetry_names": [
    {
      "value": "Lotus Renault 98T",
      "basis": "Base configuration of the same car, observed exactly at Daytona. The vehicle selection screen offers no low-downforce package for this class, so the unsuffixed name is the base and this car has two aero identities rather than three, both of which are recorded here. AMS2 selects it by circuit, so a driver reaches it without choosing it. Controls are inherited from the driven high-downforce configuration and were not separately tested."
    }
  ]
}
