{
  "schema_version": "1.0.0",
  "dataset_version": "0.5.70",
  "approved_at": "2026-09-08",
  "record_id": "alpine-a110-cup",
  "simulator": "raceroom",
  "telemetry_name": "Alpine A110 Cup",
  "observed_game_version": "0.9.8.20",
  "observed_through": "SimHub guided verification observation raceroom.alpine-a110-cup.20260907t230234640z-54f14146",
  "approved_controls": {
    "forward_gears": 6,
    "shift_actuation": "sequential-paddles",
    "shift_pattern": "sequential",
    "standing_start_clutch": "unknown",
    "automatic_cut": "unknown",
    "automatic_blip": "unknown",
    "wheel_rim_shape": "d-shaped",
    "wheel_integrated_display": "yes",
    "wheel_shift_lights": "yes",
    "wheel_open_top": "no"
  },
  "confidence_notes": "The exact 2018 Alpine A110 Cup identity and established control fields come from the candidate authoritative sources. Fields absent from those sources remain unknown in the real-car baseline; the exact simulator values remain simulator-specific guided observations.",
  "scope_notes": "New season-specific identity reviewed from one public guided-drive submission and independent exact-year sources.",
  "telemetry_class": "Alpine A110 Cup"
}
