{
  "schema_version": "1.0.0",
  "dataset_version": "0.3.53",
  "approved_at": "2026-08-16",
  "record_id": "passat-hot-cars",
  "simulator": "ams2",
  "telemetry_name": "Passat Hot Cars",
  "telemetry_class": "Hot Cars",
  "observed_game_version": "1.6.9.91",
  "observed_through": "SimHub guided verification observation ams2.passat-hot-cars.20260816t033926997z-af281b1d",
  "approved_controls": {
    "forward_gears": 4,
    "shift_actuation": "h-pattern",
    "shift_pattern": "standard-h",
    "standing_start_clutch": "required",
    "throttle_lift": "required",
    "automatic_cut": "no",
    "automatic_blip": "no",
    "manual_blip": "optional",
    "wheel_rim_shape": "round",
    "wheel_integrated_display": "no",
    "wheel_shift_lights": "no",
    "wheel_open_top": "no",
    "running_shift_clutch": "not-required"
  },
  "confidence_notes": "Guided testing directly established the gear count, the standing-start clutch, the clutchless running shifts, and the automatic cut and blip state.",
  "scope_notes": "Single exact identity staged from one guided-verification drive."
}
